<?xml version="1.0" encoding="UTF-8"?>
<acquisti xmlns:xsi="http://www.w3.org/2001/XMLSchema-instance" xsi:noNamespaceSchemaLocation="../schema/schemaAcquisti.xsd"><acquisto id="1" id_cliente="4" data="2024-07-26" crediti_bonus_ricevuti="5" crediti_bonus_utilizzati="0" totale_effettivo="334"><prodotti><prodotto id_prodotto="1" prezzo="260"/><prodotto id_prodotto="3" prezzo="74"/></prodotti><indirizzo_consegna>Via Milano 1</indirizzo_consegna></acquisto><acquisto id="2" id_cliente="4" data="2024-07-26" crediti_bonus_ricevuti="7" crediti_bonus_utilizzati="0" totale_effettivo="153"><prodotti><prodotto id_prodotto="2" prezzo="153"/></prodotti><indirizzo_consegna>Via Milano 1</indirizzo_consegna></acquisto></acquisti>
