<?xml version="1.0" encoding="UTF-8"?>
<acquisti xmlns:xsi="http://www.w3.org/2001/XMLSchema-instance" xsi:noNamespaceSchemaLocation="../schema/schemaAcquisti.xsd"><acquisto id="1" id_cliente="3" data="2024-06-08" crediti_bonus_utilizzati="0" totale_effettivo="170" crediti_bonus_ricevuti="3"><prodotti><prodotto id_prodotto="1" prezzo="170"/></prodotti><indirizzo_consegna>Via Rossi 15 Latina 04100</indirizzo_consegna></acquisto><acquisto id="2" id_cliente="3" data="2024-06-10" crediti_bonus_utilizzati="0" totale_effettivo="67" crediti_bonus_ricevuti="3"><prodotti><prodotto id_prodotto="2" prezzo="67"/></prodotti><indirizzo_consegna>Via Verdi 1 Roma 00042</indirizzo_consegna></acquisto><acquisto id="3" id_cliente="4" data="2024-06-15" crediti_bonus_utilizzati="0" totale_effettivo="237" crediti_bonus_ricevuti="6"><prodotti><prodotto id_prodotto="1" prezzo="170"/><prodotto id_prodotto="2" prezzo="67"/></prodotti><indirizzo_consegna>Via Neri 78 Aosta 11100</indirizzo_consegna></acquisto><acquisto id="4" id_cliente="4" data="2024-07-25" crediti_bonus_ricevuti="14" crediti_bonus_utilizzati="15" totale_effettivo="296"><prodotti><prodotto id_prodotto="2" prezzo="205"/><prodotto id_prodotto="4" prezzo="91"/></prodotti><indirizzo_consegna>Via Rossi 10</indirizzo_consegna></acquisto><acquisto id="5" id_cliente="3" data="2024-07-25" crediti_bonus_ricevuti="7" crediti_bonus_utilizzati="0" totale_effettivo="340"><prodotti><prodotto id_prodotto="1" prezzo="340"/></prodotti><indirizzo_consegna>Via Dei Girasoli 10</indirizzo_consegna></acquisto><acquisto id="6" id_cliente="4" data="2024-07-25" crediti_bonus_ricevuti="7" crediti_bonus_utilizzati="0" totale_effettivo="340"><prodotti><prodotto id_prodotto="1" prezzo="340"/></prodotti><indirizzo_consegna>Via Caldara 8</indirizzo_consegna></acquisto><acquisto id="7" id_cliente="4" data="2024-07-25" crediti_bonus_ricevuti="7" crediti_bonus_utilizzati="0" totale_effettivo="340"><prodotti><prodotto id_prodotto="1" prezzo="340"/></prodotti><indirizzo_consegna>Via Rossi 10</indirizzo_consegna></acquisto><acquisto id="8" id_cliente="4" data="2024-07-25" crediti_bonus_ricevuti="0" crediti_bonus_utilizzati="10" totale_effettivo="66"><prodotti><prodotto id_prodotto="3" prezzo="66"/></prodotti><indirizzo_consegna>Via Rossi 10</indirizzo_consegna></acquisto><acquisto id="9" id_cliente="8" data="2024-07-26" crediti_bonus_ricevuti="14" crediti_bonus_utilizzati="0" totale_effettivo="277"><prodotti><prodotto id_prodotto="2" prezzo="205"/><prodotto id_prodotto="5" prezzo="72"/></prodotti><indirizzo_consegna>Via dei Tulipani 3</indirizzo_consegna></acquisto><acquisto id="10" id_cliente="8" data="2024-07-26" crediti_bonus_ricevuti="1" crediti_bonus_utilizzati="11" totale_effettivo="74"><prodotti><prodotto id_prodotto="3" prezzo="74"/></prodotti><indirizzo_consegna>Via dei Tulipani 2</indirizzo_consegna></acquisto></acquisti>
